{
  "manifest_version": "1.0",
  "manifest_id": "paper12.transformer.v2",
  "record_kind": "diagnostic_analogue",
  "sof_semantics_version": "2.0",
  "adapter": {
    "id": "paper12-v1-to-v2",
    "version": "2.0",
    "domain": "synthetic transformer activation",
    "source_type": "finite token-space matrices"
  },
  "space": {
    "dimension": null,
    "scalar_field": "declared_analogue"
  },
  "capabilities": {
    "sectorization": {
      "availability": "NOT_DECLARED",
      "description": "Capability not declared by this record."
    },
    "operator_carrier": {
      "availability": "NOT_DECLARED",
      "description": "Capability not declared by this record."
    },
    "operator_system": {
      "availability": "NOT_DECLARED",
      "description": "Capability not declared by this record."
    },
    "route_carrier": {
      "availability": "NOT_DECLARED",
      "description": "Capability not declared by this record."
    },
    "word_carrier": {
      "availability": "NOT_DECLARED",
      "description": "Capability not declared by this record."
    },
    "positive_associative_closure": {
      "availability": "NOT_DECLARED",
      "description": "Capability not declared by this record."
    },
    "observable_star_closure": {
      "availability": "NOT_DECLARED",
      "description": "Capability not declared by this record."
    },
    "sector_enriched_star_closure": {
      "availability": "NOT_DECLARED",
      "description": "Capability not declared by this record."
    },
    "lie_hall_carrier": {
      "availability": "NOT_DECLARED",
      "description": "Capability not declared by this record."
    },
    "deformation_chart": {
      "availability": "NOT_DECLARED",
      "description": "No fixed typed deformation chart is declared by the aggregate record."
    },
    "proxy_diagnostic": {
      "availability": "NOT_DECLARED",
      "description": "Capability not declared by this record."
    },
    "diagnostic_analogue": {
      "availability": "DECLARED",
      "description": "Provenance-bound descriptors with an explicit mapping and strict negative boundary.",
      "configuration": {
        "analogue_mapping_id": "transformer-analogue-mapping"
      }
    }
  },
  "semantic_convention_requirements": {
    "operative_alphabet": "not_applicable",
    "word_convention": "not_applicable",
    "projector_letter_policy": "not_applicable",
    "direction_convention": "not_applicable",
    "depth_indexing": "not_applicable",
    "hall_convention": "not_applicable"
  },
  "run_policy_requirements": {
    "threshold": "optional",
    "cutoff": "not_applicable",
    "norm": "optional",
    "numerical_tolerance": "optional",
    "saturation_audit": "not_applicable",
    "sampling_grid": "optional",
    "trajectory_parameterization": "optional"
  },
  "notes": [
    "The frozen v1 envelope records finite token groups and derived shadows, but it does not bind the two operative matrices as an explicit reconstruction artifact.",
    "Strict admission requires a new source-addressed reconstruction of the complete (V,Q,Y) data. No independently declared skew-Hermitian family or Hall convention is present."
  ]
}
